{
  "$schema": "../project_control/schemas/template-roadmap.v1.schema.json",
  "schema_version": "1.0.0",
  "updated_at": "2026-09-09T00:51:04+02:00",
  "template": {
    "name": "Squelette",
    "repository": "Squelette V3 -runtime-proof (GitHub privé JyMinet/squelette, NAS NAS)",
    "backups": [
      "origin (GitHub)",
      "nas (NAS)"
    ],
    "current_version": "3.19.1"
  },
  "versions": [
    {
      "version": "3.0.0",
      "date": "2026-09-05",
      "label": "point de départ",
      "decisions": []
    },
    {
      "version": "3.1.0",
      "date": "2026-09-06",
      "label": "corrections",
      "decisions": [
        "TPL-D-001",
        "TPL-D-002",
        "TPL-D-003"
      ]
    },
    {
      "version": "3.2.0",
      "date": "2026-09-06",
      "label": "garde-fous",
      "decisions": [
        "TPL-D-004",
        "TPL-D-005",
        "TPL-D-006"
      ]
    },
    {
      "version": "3.3.0",
      "date": "2026-09-06",
      "label": "reprise de l'existant",
      "decisions": [
        "TPL-D-007",
        "TPL-D-008"
      ]
    },
    {
      "version": "3.4.0",
      "date": "2026-09-06",
      "label": "mise à niveau",
      "decisions": [
        "TPL-D-009"
      ]
    },
    {
      "version": "3.4.1",
      "date": "2026-09-07",
      "label": "tests autonomes",
      "decisions": [
        "TPL-D-010"
      ]
    },
    {
      "version": "3.5.0",
      "date": "2026-09-07",
      "label": "deux confirmations",
      "decisions": [
        "TPL-D-011",
        "TPL-D-012"
      ]
    },
    {
      "version": "3.6.0",
      "date": "2026-09-07",
      "label": "preuve de lecture",
      "decisions": [
        "TPL-D-013",
        "TPL-D-014"
      ]
    },
    {
      "version": "3.6.1",
      "date": "2026-09-07",
      "label": "correctif",
      "decisions": [
        "TPL-D-015"
      ]
    },
    {
      "version": "3.7.0",
      "date": "2026-09-07",
      "label": "style de retour",
      "decisions": [
        "TPL-D-016"
      ]
    },
    {
      "version": "3.8.0",
      "date": "2026-09-08",
      "label": "ROADMAP dans le dossier",
      "decisions": [
        "TPL-D-017",
        "TPL-D-018"
      ]
    },
    {
      "version": "3.9.0",
      "date": "2026-09-08",
      "label": "vitrine GitHub",
      "decisions": [
        "TPL-D-019",
        "TPL-D-020"
      ]
    },
    {
      "version": "3.9.1",
      "date": "2026-09-08",
      "label": "portée des renommages et gate",
      "decisions": [
        "TPL-D-021",
        "TPL-D-022"
      ]
    },
    {
      "version": "3.10.0",
      "date": "2026-09-09",
      "label": "les autorisations (lot A)",
      "decisions": [
        "TPL-D-023",
        "TPL-D-024"
      ]
    },
    {
      "version": "3.11.0",
      "date": "2026-09-09",
      "label": "ce que le squelette affirme (lot B)",
      "decisions": [
        "TPL-D-025",
        "TPL-D-026"
      ]
    },
    {
      "version": "3.12.0",
      "date": "2026-09-09",
      "label": "la robustesse d'exécution (lot C)",
      "decisions": [
        "TPL-D-027",
        "TPL-D-028"
      ]
    },
    {
      "version": "3.13.0",
      "date": "2026-09-09",
      "label": "la langue au choix (P14, étape 1)",
      "decisions": [
        "TPL-D-029",
        "TPL-D-030"
      ]
    },
    {
      "version": "3.14.0",
      "date": "2026-09-09",
      "label": "ce que le squelette accepte comme preuve",
      "decisions": [
        "TPL-D-031",
        "TPL-D-032"
      ]
    },
    {
      "version": "3.14.1",
      "date": "2026-09-09",
      "label": "les décisions figées gardent leur vocabulaire",
      "decisions": [
        "TPL-D-033"
      ]
    },
    {
      "version": "3.15.0",
      "date": "2026-09-09",
      "label": "une preuve ne contredit pas sa pièce, et l'accueil dit ce qu'il attend",
      "decisions": [
        "TPL-D-035"
      ]
    },
    {
      "version": "3.15.1",
      "date": "2026-09-09",
      "label": "la campagne ratée garde sa place",
      "decisions": [
        "TPL-D-037"
      ]
    },
    {
      "version": "3.15.2",
      "date": "2026-09-10",
      "label": "l'essai de la vue héritée passe son tour",
      "decisions": [
        "TPL-D-039"
      ]
    },
    {
      "version": "3.15.3",
      "date": "2026-09-10",
      "label": "un statut est ce que le document déclare, une clôture relit son mandat",
      "decisions": [
        "TPL-D-041"
      ]
    },
    {
      "version": "3.16.0",
      "date": "2026-09-10",
      "label": "un diagnostic n'est pas un verdict, et une montée ne laisse pas le projet sans issue",
      "decisions": [
        "TPL-D-043"
      ]
    },
    {
      "version": "3.16.1",
      "date": "2026-09-10",
      "label": "le garde-fou est là où Git le cherche, et ce qu'il ne peut pas lire, il le refuse",
      "decisions": [
        "TPL-D-045"
      ]
    },
    {
      "version": "3.16.2",
      "date": "2026-09-10",
      "label": "ce que le commit emporte, c'est l'index",
      "decisions": [
        "TPL-D-047"
      ]
    },
    {
      "version": "3.17.0",
      "date": "2026-09-10",
      "label": "les records s'écrivent un à la fois, et un projet ne naît pas amputé",
      "decisions": [
        "TPL-D-051"
      ]
    },
    {
      "version": "3.17.1",
      "date": "2026-09-11",
      "label": "l'essai ne mesure que ce qu'il annonce",
      "decisions": [
        "TPL-D-054"
      ]
    },
    {
      "version": "3.18.0",
      "date": "2026-09-11",
      "label": "la ligne du passé ne bouge que sur décision",
      "decisions": [
        "TPL-D-056",
        "TPL-D-057"
      ]
    },
    {
      "version": "3.18.1",
      "date": "2026-09-11",
      "label": "une fusion n'emporte que ce que sa branche a produit",
      "decisions": [
        "TPL-D-059"
      ]
    },
    {
      "version": "3.18.2",
      "date": "2026-09-11",
      "label": "le garde-fou range ses copies jetables",
      "decisions": [
        "TPL-D-061"
      ]
    },
    {
      "version": "3.19.0",
      "date": "2026-09-11",
      "label": "le squelette sait se publier",
      "decisions": [
        "TPL-D-063"
      ]
    },
    {
      "version": "3.19.1",
      "date": "2026-09-11",
      "label": "les noms lus tels quels, les copies prouvées siennes",
      "decisions": [
        "TPL-D-065"
      ]
    }
  ],
  "next_version": null,
  "chantiers": [
    {
      "id": "P1",
      "title": "Un seul squelette de référence",
      "state": "DONE",
      "summary": "Un seul dossier versionné, dix versions numérotées, anciennes copies archivées, sauvegardé à deux endroits.",
      "versions": [
        "3.0.0",
        "3.1.0"
      ],
      "decisions": [
        "TPL-D-003",
        "TPL-D-004"
      ],
      "scope": "provenance/maintenance/scopes/p1-consolidation-baseline-unique.md"
    },
    {
      "id": "P2",
      "title": "Mettre à niveau un projet quand le squelette évolue",
      "state": "DONE",
      "summary": "Chaque projet sait quelle version il utilise et peut se mettre à niveau sans réécrire son histoire ; prouvé sur une copie d'Alpha, puis fait pour de vrai (3.6.1).",
      "versions": [
        "3.3.0",
        "3.4.0",
        "3.4.1"
      ],
      "decisions": [
        "TPL-D-007",
        "TPL-D-008",
        "TPL-D-009",
        "TPL-D-010"
      ],
      "scope": "provenance/maintenance/scopes/p2-scope-template-upgrade.md"
    },
    {
      "id": "P3",
      "title": "Prouver que l'IA a lu les règles avant d'agir",
      "state": "DONE",
      "summary": "L'IA doit présenter une empreinte des documents lus avant de commencer ; corrigé pour les projets qui ont déjà un historique.",
      "versions": [
        "3.6.0",
        "3.6.1"
      ],
      "decisions": [
        "TPL-D-013",
        "TPL-D-014",
        "TPL-D-015"
      ],
      "scope": "provenance/maintenance/scopes/p3-scope-preuve-lecture-autorites.md"
    },
    {
      "id": "P4",
      "title": "Revue contradictoire en option",
      "state": "SCOPED",
      "summary": "Fiche prête ; pas encore autorisée ; désactivée par défaut.",
      "versions": [],
      "decisions": [],
      "scope": "provenance/maintenance/scopes/p4-scope-capability-adversarial-review.md"
    },
    {
      "id": "P5",
      "title": "Travailler par phases",
      "state": "TO_SCOPE",
      "summary": "Un niveau au-dessus des chantiers, avec ouverture, vérification de clôture et gel. Pas encore de fiche.",
      "versions": [],
      "decisions": [],
      "scope": null
    },
    {
      "id": "P6",
      "title": "Guide de reprise dans le dossier",
      "state": "DONE",
      "summary": "Fusionné avec l'étape 2 de la ROADMAP : la vue est générée par le contrôleur dans le dossier (où on en est, prochaine étape, ce qui attend le Project Owner). Livré et promu en 3.8.0 (8 sept.).",
      "versions": [
        "3.8.0"
      ],
      "decisions": [
        "TPL-D-017",
        "TPL-D-018"
      ],
      "scope": "provenance/maintenance/scopes/p12-scope-roadmap-dediee.md"
    },
    {
      "id": "P7",
      "title": "Critères d'entrée d'un chantier",
      "state": "TO_SCOPE",
      "summary": "Pas encore de fiche.",
      "versions": [],
      "decisions": [],
      "scope": null
    },
    {
      "id": "P8",
      "title": "Petits points",
      "state": "PARTIAL",
      "summary": "Garde-fou Git : fait (3.2.0). Restent : profil d'adoption vérifié, exercice réel de restauration.",
      "versions": [
        "3.2.0"
      ],
      "decisions": [],
      "scope": null
    },
    {
      "id": "P9",
      "title": "Un seul état de suivi",
      "state": "DONE",
      "summary": "Les fiches de suivi ne vivent que sur la branche principale ; le contrôleur les enregistre lui-même (3.2.0).",
      "versions": [
        "3.2.0"
      ],
      "decisions": [
        "TPL-D-005"
      ],
      "scope": "provenance/maintenance/scopes/p9-scope-records-administratifs-et-branches.md"
    },
    {
      "id": "P10",